id,first_author,year,title,em_category_code,em_category,ai_category_code,ai_category,ai_technique,is_review,core_claim,results,limitations,source_file
161,Karimov et al.,2024,Machine Learning Based Approach to Accurately Model and Optimize Microwave Filters,F2,Microwave filters and circuit components,1,Neural networks and deep learning,ANN (MLP) surrogate modeling of S-parameters,False,"ANN models can accurately model and optimize the S-parameters of four types of microwave filters (LPF, HPF, BPF, BSF) in the 0–10 GHz band.","The ANN models achieved R² > 99% for all four filter types (LPF, HPF, BPF, BSF); for example, for BSF the accuracy on test data was R² 99.88–99.91% with MAE on the order of 10⁻³.",Not stated explicitly: the model was validated only for four specific filter topologies on an FR4 substrate in the 0–10 GHz band; the authors do not discuss transferability to other substrates/topologies.,old/179 - Machine Learning Based Approach to Accurately Model and Optimize Microwave Filters.pdf
343,Koziel et al.,2024,Machine-Learning-Based Global Optimization of Microwave Passives with Variable-Fidelity EM Models and Response Features,F2,Microwave filters and circuit components,2,Classical machine learning,Co-kriging (GPR) surrogate + response features + PSO with variable-fidelity EM modeling,False,"The authors present a global optimization technique for microwave passive components combining variable-fidelity EM simulations, the response features method, and a kriging-based ML framework with PSO as the search mechanism.","The proposed framework achieves competitive design quality with typically only about sixty high-fidelity EM analyses, compared to nature-inspired algorithms, gradient-based search, and other ML techniques.","Not stated explicitly: the available text does not contain a discussion section with limitations; according to the introduction, strongly nonlinear circuit characteristics generally pose a challenge for surrogate-assisted methods.",old/64 - Machine-learning-based global optimization of microwave passives with variable-fidelity EM models and response features.pdf
159,Liu et al.,2024,An Efficient and General Automated Power Amplifier Design Method Based on Surrogate Model Assisted Hybrid Optimization Technique,F2,Microwave filters and circuit components,5,Metaheuristics and Bayesian optimization,Bayesian Neural Network (BNN) surrogate model + hybrid evolutionary optimization algorithm (E-GASPAD),False,"The authors propose E-GASPAD, a method based on a Bayesian neural network (BNN) as a surrogate model combined with a novel hybrid optimization algorithm for fully automated layout-level design of power amplifiers (PA) without the need for a high-quality initial design.","The method was demonstrated on a 27-31 GHz class-AB PA and a 24-31 GHz wideband Doherty PA with approx. 30 design variables; high-performance layout-level designs were obtained automatically within a few hundred simulations (less than 72 hours), accounting for full-wave EM simulations.",Not stated explicitly in the available text (a detailed discussion of limitations is missing); future work mentions the need to validate E-GASPAD on more PA designs and to develop a software tool.,old/177 - An efficient and general automated power amplifier design method based on surrogate model assisted hybrid optimization technique.pdf
196,Liu et al.,2024,Adaptive Homotopy-Based Inverse Model for the Geometry Scaling of Microwave Filters,F2,Microwave filters and circuit components,3,Generative and inverse models,Adaptive homotopy continuation (HC) method + database-based inverse model of geometric/electrical parameters,False,The authors propose an adaptive homotopy continuation method that builds a database of geometric and electrical parameters (including tracking of transmission zeros) to train an inverse model enabling efficient geometry scaling of microwave filters.,"The method is demonstrated on three classes of filters, including coaxial resonator and dielectric waveguide filters, and performs geometry scaling automatically and more efficiently than existing algorithms; specific numerical speedup/accuracy values are not stated in the extracted text.","The authors state that over 90% of the total design time is taken up by high-fidelity EM simulation, which remains a computational bottleneck; the adaptive homotopy step must balance database size and computational cost.",old/209 - Adaptive Homotopy-Based Inverse Model for the Geometry Scaling of Microwave Filters.pdf
184,Xu et al.,2024,Flexible Inverse Design of Microwave Filter Customized on Demand With Wavelet Transform Deep Learning,F2,Microwave filters and circuit components,1,Neural networks and deep learning,DNN with wavelet transform (WTDL) + PSO sampling + MLSMOTE,False,"An HQS-WTDL scheme (high-quality sampling + wavelet transform + deep learning) is proposed for flexible, customized inverse design of microwave filters, combining PSO sampling, MLSMOTE data augmentation, and a neural network with wavelet transform of S-parameters.","The HQS-WTDL approach achieves better modeling efficiency and inverse design efficiency than conventional methods and enables rapid customization of parameters (center frequencies, bandwidths) with good prediction accuracy; specific numerical values are not stated in the available excerpt.","Not stated explicitly: the available excerpt does not contain a conclusion; the method is demonstrated on only one example (hairpin bandpass filter), and generalization to other filter topologies is not shown in the excerpt.",old/199 - Flexible Inverse Design of Microwave Filter Customized on Demand With Wavelet Transform Deep Learning.pdf
198,Zhang et al.,2024,Multichannel Wavelet Kernel Network for High Dimensional Inverse Modeling of Microwave Filters,F2,Microwave filters and circuit components,1,Neural networks and deep learning,Multichannel Wavelet Kernel Network (CNN + discrete wavelet transform) with two-phase PSO training,False,"The authors propose a multichannel wavelet kernel network (MWKN) with two-phase PSO-based training for high-dimensional inverse modeling of microwave filters, using discrete wavelet transform to extract multiscale features from S-parameters.","The model predicts filter geometry meeting specifications in 0.42 s, whereas traditional design using EM simulation requires a total of 8.17 h (0.19 h preliminary design + approximately 7.95 h iterative design refinement); the model also has smaller errors and fewer parameters than compared NN models.","The authors state that future work will focus on integrating additional simulation and experimental data to improve generalization, and on resolving the non-uniqueness problem of training samples in high-dimensional inverse modeling.",old/210 - Multichannel Wavelet Kernel Network for High Dimensional Inverse Modeling of Microwave Filters.pdf
177,Koziel et al.,2025,Globalized parameter tuning of microwave passives by dimensionality-reduced surrogates and multi-fidelity simulations,F2,Microwave filters and circuit components,5,Metaheuristics and Bayesian optimization,PSO (surrogate-assisted) + dimensionality reduction (sensitivity analysis) + multi-fidelity EM simulation,False,"An AI/ML method is proposed for global tuning of microwave passive component parameters, combining dimensionality reduction via global sensitivity analysis, multi-fidelity EM simulation, and a two-stage (global surrogate + local refinement) search.","The method was verified on four microstrip circuits; the average optimization cost corresponds to approximately 90 EM simulations, with design quality competitive against benchmark methods.","Not stated explicitly: the available excerpt does not contain a conclusion; the method was verified only on four microstrip circuits, and broader applicability to other structure types is not discussed in the excerpt.",old/193 - Globalized parameter tuning of microwave passives by dimensionality-reduced surrogates and multi-fidelity simulations.pdf
249,Kiarashinejad et al.,2020,Deep learning approach based on dimensionality reduction for designing electromagnetic nanostructures,F3,"Metasurfaces, FSS and absorbers (non-shielding)",3,Generative and inverse models,Autoencoder for dimensionality reduction + analytical formulation for inverse design of nanostructures,False,"The authors propose a computationally efficient approach based on autoencoder-based dimensionality reduction, which converts the conventional many-to-one design problem of EM nanostructures into a simpler one-to-one problem solvable analytically, applied to reconfigurable optical metasurfaces made of phase-change materials (PCM).",The approach reduces the computational complexity of solving both the forward and inverse problems by orders of magnitude compared to conventional methods; experimental results from fabricated devices show good agreement with the method's predictions.,Not stated explicitly: the authors do not state specific limitations in the available text; the approach is demonstrated on a specific class of PCM-based reconfigurable metasurfaces and may not directly generalize to other types of nanostructures.,old/257 - Deep learning approach based on dimensionality reduction for designing electromagnetic nanostructures.pdf
152,Shi et al.,2020,Metasurface inverse design using machine learning approaches,F3,"Metasurfaces, FSS and absorbers (non-shielding)",3,Generative and inverse models,Convolutional autoencoder (CNN-based) + optimized SVM (AMID method),False,"The authors propose the AMID method (ML-based inverse metasurface design), combining a convolutional autoencoder and an optimized SVM to directly compute the metasurface structure from given design targets.","The AMID method successfully computed metasurface unit cells corresponding to the given EM properties (design targets), thereby validating its functionality and improving design efficiency; specific numerical accuracy metrics are not given in the extracted text.",Not stated explicitly: the available text lacks a specific quantification of prediction error or a comparison of computation time with conventional methods.,old/170 - Metasurface inverse design using machine learning approaches.pdf
248,Khatib et al.,2021,Deep Learning the Electromagnetic Properties of Metamaterials—A Comprehensive Review,F3,"Metasurfaces, FSS and absorbers (non-shielding)",1,Neural networks and deep learning,"Review of DNNs (feedforward, tandem, GAN/VAE) for forward and inverse design of AEM",True,"Comprehensive review of the use of deep neural networks for forward and inverse design of artificial electromagnetic materials (metamaterials, photonic crystals, plasmonics), discussing strategies, evaluation, and limitations of the approaches.",The review systematizes advances in DL for replacing/accelerating the conventional CEM simulation cycle in AEM design (both forward and inverse problems); it is a qualitative synthesis of the literature rather than the authors' own quantitative experiment.,"According to the abstract, the review discusses key limitations of DL approaches for AEM problems (availability/size of training datasets, generalization, interpretability), although no specific figures are given in the available excerpt (abstract/introduction).",old/256 - Deep Learning the Electromagnetic Properties of Metamaterials—A Comprehensive Review.pdf
153,Koziel et al.,2021,Machine-Learning-Powered EM-Based Framework for Efficient and Reliable Design of Low Scattering Metasurfaces,F3,"Metasurfaces, FSS and absorbers (non-shielding)",5,Metaheuristics and Bayesian optimization,Three-stage surrogate-assisted global + local EM optimization (trust-region gradient algorithm),False,"The authors present a three-stage ML-driven framework (global surrogate-assisted optimization, local refinement, direct EM optimization) for automated design of low radar cross-section (RCS) metasurfaces.",The framework improved the RCS-reduction bandwidth by 15-25% over the originally published designs and enabled the design of a new metasurface with a relative bandwidth exceeding 100%; the computational cost corresponds to only a few dozen full-surface EM simulations.,The framework is limited to structures with a fixed topology (optimization of geometric/material parameters); optimizing the metasurface topology itself is outside the scope of the work.,old/171 - Machine-Learning-Powered EM-Based Framework for Efficient and Reliable Design of Low Scattering Metasurfaces.pdf
109,El-kenawy et al.,2022,Optimized Ensemble Algorithm for Predicting Metamaterial Antenna Parameters,F3,"Metasurfaces, FSS and absorbers (non-shielding)",2,Classical machine learning,"Ensemble (SVM, Random Forest, KNN, Decision Tree) + AD-PRS-Guided Whale Optimization (feature selection)",False,"The authors propose an optimal ensemble ML model (SVM, Random Forest, KNN, Decision Tree as base models) with feature selection via the AD-PRS-Guided Whale Optimization algorithm for predicting the bandwidth and gain of a metamaterial antenna.","The Random Forest-based model achieves an RMSE of 0.0102 for bandwidth and an RMSE of 0.0891 for gain, outperforming both the other tested models and the averaged ensemble model.","The authors state that the proposed model will be compared with CST software simulations in future work, indicating that direct validation against a full-wave EM simulator is currently lacking.",old/131 - Optimized Ensemble Algorithm for Predicting Metamaterial Antenna Parameters.pdf
373,Zheng et al.,2022,A Wideband Low-RCS Metasurface-Inspired Circularly Polarized Slot Array Based on AI-Driven Antenna Design Optimization Algorithm,F3,"Metasurfaces, FSS and absorbers (non-shielding)",5,Metaheuristics and Bayesian optimization,PSADEA - surrogate model-assisted (Gaussian process) hybrid differential evolution for antenna optimization,False,"The authors propose a metasurface-inspired wideband circularly polarized slot array with low RCS, whose feed network is optimized by the AI algorithm PSADEA (surrogate-assisted differential evolution).","The achieved bandwidth is 53.2% for |S11|<-10 dB, 50% for AR<3 dB, and 147.8% for the RCS reduction band; more than 5 dB RCS reduction is achieved over the 5-17.5 GHz band (111.1% relative bandwidth); the measured results agree well with the simulations and achieve the widest AR bandwidth among published low-RCS arrays.",Not stated explicitly: no specific limitations of the proposed approach are mentioned in the conclusion; the text only states that the built-in CST optimizers failed and that PSADEA was therefore used.,old/91 - A Wideband Low-RCS Metasurface-Inspired Circularly Polarized Slot Array Based on AI-Driven Antenna Design Optimization Algorithm.pdf
260,Adepoju et al.,2023,Metaheuristic-Based Optimization and Prototype Investigation of Low Frequency Metamaterial for Wireless Power Transfer Application,F3,"Metasurfaces, FSS and absorbers (non-shielding)",5,Metaheuristics and Bayesian optimization,Metaheuristic optimization (Jaya algorithm) of MTM structure parameters,False,"The authors design and experimentally verify a compact low-frequency metamaterial (MTM) structure for wireless power transfer, complemented by a metaheuristic optimization algorithm to lower the resonant frequency at which negative permeability occurs.","Metaheuristic optimization reduced the resonant frequency from a simulated 1.2 MHz to 750 kHz; experimental measurements on a fabricated prototype (VNA Keysight ENA5061) show good agreement with the simulations, validating the accuracy of the optimization procedure.","In the conclusion, the authors state that achieving lower resonant frequencies (preferably 85 kHz) requires developing more advanced optimization algorithms as future work, suggesting that the achieved 750 kHz does not yet meet the target industrial standard.",old/267 - Metaheuristic-Based Optimization and Prototype Investigation of Low Frequency Metamaterial for Wireless Power Transfer Application.pdf
59,Dong et al.,2025,Physics-Informed Reinforcement Learning for Multi-Band Octagonal Fractal Frequency-Selective Surface Optimization,F3,"Metasurfaces, FSS and absorbers (non-shielding)",4,Reinforcement learning,Physics-informed reinforcement learning (PIRL) with direct interaction with CST,False,"Physics-informed reinforcement learning (PIRL), interacting directly with CST, can autonomously design an octagonal fractal FSS with single- and dual-band response more efficiently than classical PSO.","For single-band OF-FSS designs, relative bandwidth errors of 0–6% versus the target were achieved (e.g., 106 MHz vs. a 100 MHz target); for dual-band designs, average errors of 5.8% (1.8 GHz) and 2.4% (3.5 GHz); compared to PSO, PIRL requires an order of magnitude fewer iterations (e.g., 42–169 vs. 430–700 for PSO) at comparable or better accuracy.",The work is purely simulation-based (CST); experimental fabrication and measurement of a prototype were not performed due to time constraints.,Physics-Informed Reinforcement Learning for Multi-Band Octagonal Fractal Frequency-Selective Surface Optimization.pdf
44,Xu et al.,2025,Machine Learning-Based-Inverse Topological Design Method for Active Frequency-Selective Surface (ITDM-AFSS),F3,"Metasurfaces, FSS and absorbers (non-shielding)",3,Generative and inverse models,MLP-mixer for inverse topological design (tandem/inverse network),False,"The authors propose an ML-based inverse topological design method (ITDM-AFSS) using an MLP-mixer architecture, which maps EM responses in the ON/OFF states of a p-i-n diode directly to the pixelated topology of an active frequency-selective surface (AFSS) with a large number of degrees of freedom.","Relative errors between the target and predicted |S11| reach 0.3% (OFF state) and 3.8% (ON state); compared to a binary genetic algorithm (94 GB RAM, over 12 days of computation, errors of 3.2%/8.2%), the proposed method requires only 2.5 h of training, 11.7 GB of GPU memory, and 4.49 GB of RAM.","The authors state that minor differences persist between the predicted and reference structure, caused by the inherent nonuniqueness of inverse modeling.",Machine_Learning-Based-Inverse_Topological_Design_Method_for_Active_Frequency-Selective_Surface_ITDM-AFSS.pdf
2,Zheng et al.,2025,A Machine Learning-Based Inverse Design Method With Hybrid Modeling for Multilayer Frequency-Selective Surface (FSS) Design,F3,"Metasurfaces, FSS and absorbers (non-shielding)",3,Generative and inverse models,Hybrid topological-parametric inverse neural network (IHDM-MLFSS),False,The authors propose an ML-based inverse hybrid design method (IHDM-MLFSS) combining topological and parametric modeling for designing multilayer frequency-selective surfaces (FSS) based on a given |S11| and number of layers.,The method achieves a misfit of 0.5% and 0.4% on two test targets and allows designing FSS even outside the frequency range of the training data; the authors state that it outperforms three other commonly used ML models.,"Not stated explicitly: the text does not specify concrete limitations of the method, except noting that it applies to low-dispersion or dispersion-free materials and structures with up to five layers.",A_Machine_Learning-Based_Inverse_Design_Method_With_Hybrid_Modeling_for_Multilayer_Frequency-Selective_Surface_FSS_Design.pdf
50,Karamzadeh et al.,2026,"Machine Learning for Metamaterial Design: Methods, Challenges, and Future Perspectives",F3,"Metasurfaces, FSS and absorbers (non-shielding)",1,Neural networks and deep learning,"Review: neural networks (forward/inverse modeling), graph models, reinforcement learning (RL), hybrid optimization-learning frameworks for RIS",True,"This review article comprehensively maps ML methodologies for the design of metamaterials and metasurfaces, including forward modeling, inverse design, topology optimization, and control of programmable metasurfaces (RIS), extending to biomedical sensing applications.","This is a qualitative review without a single unified numerical result; it summarizes that neural networks, graph models, reinforcement learning, and hybrid optimization-learning frameworks reduce computational cost and enable adaptive real-time reconfiguration of metasurfaces.","The authors explicitly identify generalization, interpretability, and integration of ML models with electromagnetic solvers as key challenges.",Machine_Learning_for_Metamaterial_Design_Methods_Challenges_and_Future_Perspectives.pdf
66,Li et al.,2026,Robust Forward Surrogates for Free-Form Frequency Selective Surfaces With Uncertainty Quantification by Bayesian Deep Learning,F3,"Metasurfaces, FSS and absorbers (non-shielding)",1,Neural networks and deep learning,Bayesian deep neural network (BNN) with uncertainty quantification,False,"A Bayesian deep surrogate model can predict the EM response of freeform FSS (128×128 binary matrices) while simultaneously quantifying prediction uncertainty, enabling reliable forward design even outside the training distribution.","Not stated explicitly in the available text (abstract/conclusion without specific numerical accuracy metrics); the framework was experimentally validated by fabricating and measuring two FSS prototypes with different predicted uncertainty and demonstrated robustness on parametric and low-dimensional binary structures, oblique incidence, and two-layer FSS.","The authors state that the accuracy of DNN models decreases when the input deviates significantly from the training data distribution, and that DNNs are generally poorly interpretable and unreliable at signaling their own prediction error.",Robust_Forward_Surrogates_for_Free-Form_Frequency_Selective_Surfaces_With_Uncertainty_Quantification_by_Bayesian_Deep_Learning.pdf
43,Rana et al.,2026,Machine learning-based methods for frequency selective surfaces and metasurfaces,F3,"Metasurfaces, FSS and absorbers (non-shielding)",3,Generative and inverse models,"Review: VAE, GAN, DCGAN, transfer learning, VGFE-DNN, hybrid PSO/GA-AI frameworks",True,"This review article comprehensively summarizes ML methods for inverse design of frequency-selective surfaces (FSS) and metasurfaces, including VAE, GAN, DCGAN, transfer learning for phase prediction, and hybrid AI-optimization frameworks (PSO, GA).",This is a qualitative review without a single unified numerical result; the authors state that the described ML algorithms shorten the simulation time for FSS/metasurface design and enable the generation of unconventional structures with improved properties.,"Not stated explicitly: in the available excerpt (introduction and reference list), no specific limitations of the review are given.",Machine learning-based methods for frequency selective surfaces and metasurfaces.pdf
87,Haggenmiller et al.,2019,Non-parametric Error Modeling for Ultra-wideband Localization Networks,F4,"Wave propagation, channels and communication systems",2,Classical machine learning,Nonparametric estimation of the error probability density + MAP optimization (gradient-less),False,Explicit modeling of antenna delay together with nonparametric estimation of the error probability density enables accurate and fast UWB network localization even under non-line-of-sight (NLOS) conditions.,A network of 8 UWB nodes (DecaWave DWM1000) achieved 3 cm RMSE accuracy under LOS conditions and 30 cm RMSE under NLOS conditions; explicit modeling of antenna delay reduced the RMSE from 6.2 cm to 3.0 cm in the best-conditioned LOS scenario; the entire localization process (up to 128 measurements/link) took under one minute.,"The authors state that under high NLOS uncertainty the 8-node system is only marginally fully determined (28 equations, 24 unknowns), so under strongly NLOS conditions the antenna delay cannot be refined beyond its prior value.",old/111 - Non-parametric Error Modeling for Ultra-wideband Localization Networks.pdf
259,Nguyen et al.,2019,Metaheuristic Optimization Techniques for an Electromagnetic Multilayer Radome Design,F4,"Wave propagation, channels and communication systems",5,Metaheuristics and Bayesian optimization,Ant Colony Optimization for continuous domains (ACOR) compared with PSO,False,"The authors propose a method for designing a multilayer electromagnetic radome (C-sandwich) using Ant Colony Optimization for continuous domains (ACOR), maximizing and stabilizing the transmission coefficient over a wide range of incidence angles in the X and Ku bands, and compare it with PSO.","ACOR converges faster than PSO (in the X band, 56.69 s/11 iterations versus 70.18 s/24 iterations; in the Ku band, 64.13 s/12 iterations versus 71.86 s/24 iterations for PSO), with both methods finding practically the same optimal design, and the optimized radome exhibits significantly more stable transmitted power over a wide range of incidence angles than an equivalent homogeneous radome.","Not stated explicitly: the authors do not mention limitations; the design is limited to a specific five-layer C-sandwich configuration and specific frequency bands (X, Ku), and generalization to other configurations was not verified.",old/266 - Metaheuristic Optimization Techniques for an Electromagnetic Multilayer Radome Design.pdf
