id,first_author,year,title,em_category_code,em_category,ai_category_code,ai_category,ai_technique,is_review,core_claim,results,limitations,source_file
120,Akinsolu et al.,,Machine Learning-assisted Antenna Design Optimization: A Review and the State-of-the-art,F1,Antennas and antenna arrays,2,Classical machine learning,"Review of GP/kriging surrogate models, SADEA (surrogate-assisted differential evolution), space mapping, multi-fidelity kriging",True,"A review article summarizes the current state of machine-learning-assisted antenna optimization methods (surrogate-based optimization), focusing on their efficiency and optimization capability for single-objective, multi-objective, multi-fidelity, and yield-driven tasks.","This is a review with no original experiments; from the cited literature, the authors report that the SADEA family of algorithms (surrogate model-assisted differential evolution) achieves a 3- to 20-fold speedup over standard global optimization methods.","Not stated explicitly as a limitation of the work itself (this is a review); the authors merely recommend, for future use, methods suited to high-dimensional spaces without requiring an initial design as generally the most robust.",old/141 - Machine Learning-assisted Antenna Design optimization A Review and the State-of-the-art.pdf
97,Dong et al.,2019,Fast Multi-Objective Optimization of Multi-Parameter Antenna Structures Based on Improved BPNN Surrogate Model,F1,Antennas and antenna arrays,1,Neural networks and deep learning,SC-BPNN surrogate model tuned by hybrid real-binary PSO (HPSO),False,"The authors propose a sparsely connected backpropagation neural network (SC-BPNN) as a surrogate model, whose structure and weights are tuned by a hybrid real-binary PSO (HPSO), and combine it with a multi-objective evolutionary algorithm for fast optimization of multiple antenna parameters.",The proposed SC-BPNN+HPSO surrogate model achieves higher accuracy in predicting antenna behavior and significantly lower computational cost (CPU time) than earlier approaches; demonstrated on the Pareto-optimal design of a compact tri-band planar monopole antenna.,"The authors state that the computational cost of the proposed method is slightly higher than that of a simpler comparison method (scheme II), even though the prediction accuracy is significantly higher.",old/120 - Fast Multi-Objective Optimization of Multi-Parameter Antenna Structures Based on Improved BPNN Surrogate Model.pdf
112,El Misilmani et al.,2019,Machine Learning in Antenna Design: An Overview on Machine Learning Concept and Algorithms,F1,Antennas and antenna arrays,2,Classical machine learning,"Review of ML algorithms (regression, ANN, SVM, KNN, k-means); example: SADEA (GPR + differential evolution)",True,"A review article presents the fundamental concepts of machine learning (supervised, unsupervised, and reinforcement learning) and their algorithms, focusing mainly on their use in antenna design, including a comparison with conventional design methods.","No original quantitative results; as an example from the literature, it cites the SADEA method (Gaussian process regression + differential evolution), which accelerated the design and optimization of three antennas by more than 4× compared to differential evolution alone.","In the conclusion, the authors identify general challenges of ML in antenna design: selecting a suitable algorithm, problem formulation, obtaining a sufficient amount of training data (requiring many EM simulations), and data preprocessing.",old/134 - Machine Learning in Antenna Design An Overview on Machine Learning Concept and Algorithms.pdf
321,Grout et al.,2019,"Software Solutions for Antenna Design Exploration: A Comparison of Packages, Tools, Techniques, and Algorithms for Various Design Challenges",F1,Antennas and antenna arrays,5,Metaheuristics and Bayesian optimization,"Comparison of SADEA (surrogate-assisted DE) with PSO, DE, CMA-ES, TRF, N-M, SQP, IQN, PS",False,"The article compares 17 optimization methods (in six categories) implemented in antenna design tools (HFSS, CST, FEKO, MATLAB, ADE) on three representative design problems.","SADEA achieves the highest quality of results with the fewest EM simulations across all three test problems; CMA-ES, PSO, and DE are less efficient despite comparable global search capability.","The performance of the PS, SQP, TRF, N-M, and IQN methods strongly depends on the quality of the initial design; the authors note that the conclusions are based on three selected problems and may not fully generalize to all antenna problems.","old/44 - Software Solutions for Antenna Design Exploration A Comparison of Packages, Tools, Techniques, and Algorithms for Various Design Challenges.pdf"
110,Koziel et al.,2019,Performance-Based Nested Surrogate Modeling of Antenna Input Characteristics,F1,Antennas and antenna arrays,2,Classical machine learning,Two-level (nested) kriging surrogate model,False,"The authors propose a two-level (nested) kriging surrogate model for antenna input characteristics, in which the first level defines the domain of the second (final) level of the model, enabling modeling over wide ranges of geometric parameters and performance quantities.","Demonstrated on two microstrip antennas, with a favorable comparison against conventional kriging and RBF interpolation; experimental validation on fabricated prototypes showed good agreement between simulated and measured reflection characteristics, with minor frequency shifts.",The authors state that the minor differences (frequency shifts) between simulation and measurement are caused by the fact that SMA connectors were not included in the antenna's computational model.,old/132 - Performance-Based Nested Surrogate Modeling of Antenna Input Characteristics.pdf
344,Vincent et al.,2019,An Analysis of Metaheuristic Algorithms Used for the Recovery of a Failed Antenna Element in an Antenna Array,F1,Antennas and antenna arrays,5,Metaheuristics and Bayesian optimization,"Comparison of metaheuristics: Firefly, Bat, Flower Pollination, Cuckoo Search, Harmony Search, Simulated Annealing, Gradient Descent",False,"This work compares seven metaheuristic algorithms (gradient descent, simulated annealing, firefly, bat, flower pollination, cuckoo search, harmony search) for recovering the weight of a failed element in the antenna array of a GB-SAR system.","Of all the tested methods, the firefly algorithm achieves the best results in finding the weight of a failed main element in a 2x6 array (a specific numerical error/accuracy value is not given in the available excerpt).",Not stated explicitly: the study is limited to a specific 2x6 array geometry and a single-element failure scenario; generalization to multiple failures or other array configurations is not discussed in the text.,old/65 - An Analysis of Metaheuristic Algorithms Used for the Recovery of a Failed Antenna Element in an Antenna Array.pdf
207,Alzahed et al.,2020,Electromagnetic Machine Learning for Inverse Modeling Using the Spatial Singularity Expansion Method,F1,Antennas and antenna arrays,3,Generative and inverse models,Spatial Singularity Expansion Method (S-SEM) + ML inverse source model,False,"The authors propose a unified EM-ML approach combining the spatial singularity expansion method (S-SEM) with machine learning for inverse modeling and characterization of antennas, enabling reconstruction of current distribution and geometric parameters of radiators from far-field data.","The method successfully reconstructed the parameters (length, orientation) of straight and bent wire antennas and their fields; validation on a fabricated half-wave dipole antenna (1 GHz) in an anechoic chamber showed good agreement between the estimated S-SEM parameters and orientation and measurement, with some deviation in the wire length estimate.","The authors state that the deviation in wire length reconstruction is caused by the fact that the exact formula was derived for an ideal thin-wire radiation model, which may not fully hold for the fabricated probe; increasing the S-SEM order improves reconstruction but significantly slows convergence.",old/219 - Electromagnetic Machine Learning for Inverse Modeling Using the Spatial Singularity Expansion Method.pdf
101,Cui et al.,2020,A Modified Efficient KNN Method for Antenna Optimization and Design,F1,Antennas and antenna arrays,2,Classical machine learning,Modified KNN regression with self-learning (active) training-data augmentation,False,"The authors propose a modified KNN regression method with a self-learning loop that generates additional training data on its own during antenna optimization using a simulator (HFSS), thereby requiring only a very small initial dataset.","The method is 5–30× faster than traditional ML methods (ANN, Bayesian optimization); for a three-parameter antenna, only 8 training samples are needed, and for a nine-parameter model, 30 samples; validated on four different antenna examples.","The authors state that future work should focus on multi-objective optimization, since the number of training samples required grows with the number of objectives and parameters.",old/124 - A Modified Efficient KNN Method for Antenna Optimization and Design.pdf
95,El Misilmani et al.,2020,A review on the design and optimization of antennas using machine learning algorithms and techniques,F1,Antennas and antenna arrays,2,Classical machine learning,"Review of regression ML models (SVR, GPR, ANN, etc.) for antenna design and optimization",True,"A comprehensive literature review describing the use of machine learning in antenna design and optimization, including an overview of computational electromagnetics, learning categories, and regression ML models applied to antenna synthesis and analysis.","No original quantitative results; this is an extensive review (28 pages) organized by antenna type, summarizing dozens of works using ANN, SVR, GPR, and other regression ML models to predict antenna characteristics.","Not stated explicitly: the authors generally mention that the success of ML approaches strongly depends on the quality, quantity, and availability of training data, which must be obtained through simulations because standardized antenna datasets are lacking.",old/119 - A review on the design and optimization of antennas using machine learning algorithms and techniques.pdf
127,Maeurer et al.,2020,Antenna Design Exploration and Optimization using Machine Learning,F1,Antennas and antenna arrays,1,Neural networks and deep learning,RBF neural network (surrogate regression) + PCA (dimensionality reduction) + genetic algorithm/MOGA (evolutionary learning),False,"The authors show how combining design-space exploration (DoE) with machine learning techniques (RBF neural networks, PCA, evolutionary learning) can substantially accelerate the process of antenna performance analysis and optimization, on three examples with different design- and response-space dimensions.","For the blade antenna (p=4, n=4), the RBF regression model reduced the evaluation time from 90 s (simulation) to 20 ms (speedup of approx. 45,000×) with R² up to 0.9999 and median relative error of 0.03–5.3%; for the LTE dual antenna, the ML approach reduced the total optimization time to under 15 hours compared to 40.4 hours for classical optimization; evolutionary learning for a WLAN antenna with 112 binary variables reached, after approx. 4300 simulations, a solution with S11 < −10 dB in both bands (2.44 and 5.2 GHz).","The authors state that for high-dimensional discrete design spaces (2^122 combinations for the WLAN antenna), building regression models is computationally very demanding due to the discreteness and strong nonlinearity of the mapping, which is why evolutionary learning must be used instead of classical regression.",old/148 - Antenna Design Exploration and Optimization using Machine Learning.pdf
105,Pietrenko-Dabrowska et al.,2020,Expedited Yield Optimization of Narrow- and Multi-Band Antennas Using Performance-Driven Surrogates,F1,Antennas and antenna arrays,2,Classical machine learning,Performance-driven surrogate model defined by reference (pre-optimized) designs for yield optimization,False,"The authors propose a simple surrogate technique for fast yield optimization of narrowband and multi-band antennas, in which the optimization domain is defined using several pre-optimized reference designs representing the main directions of resonant-frequency variation.","Verified on a ring-slot antenna and a two- and three-band uniplanar dipole antenna; optimization was achieved at a cost of only 62, 74, and 132 EM simulations, respectively; the reliability of the results was confirmed by comparison with EM Monte Carlo simulations.",Not stated explicitly: the available text (introduction and reference conclusion) contains no separate discussion of limitations; the method generally requires a set of pre-optimized reference designs as input.,old/128 - Expedited Yield Optimization of Narrow- and Multi-Band Antennas Using Performance-Driven Surrogates.pdf
102,Wu et al.,2020,Machine-learning-assisted optimization and its application to antenna designs: Opportunities and challenges,F1,Antennas and antenna arrays,2,Classical machine learning,"Review of MLAO methods: GPR, SVM, ANN as surrogate models for antenna design",True,"A review article describes ML-assisted optimization (MLAO) of antennas as a type of surrogate-based optimization, in which an ML model (GPR, SVM, ANN) replaces computationally expensive EM simulations, and summarizes algorithms for antenna optimization and sensitivity analysis (SA).",No original quantitative results; this is a review summarizing the state of MLAO methods for antenna modeling and discussing their algorithms.,"Not stated explicitly: the text does not specify concrete limitations of individual methods, only discussing future MLAO challenges in general terms.",old/125 - Machine-learning-assisted optimization and its application to antenna designs Opportunities and challenges.pdf
117,Wu et al.,2020,Multistage Collaborative Machine Learning and its Application to Antenna Modeling and Optimization,F1,Antennas and antenna arrays,2,Classical machine learning,Multi-stage collaboration of SOGPR + symmetric and asymmetric MOGPR (Gaussian process regression),False,The authors propose a multi-stage collaborative machine learning method (MS-CoML) combining single-output (SOGPR) and symmetric/asymmetric multi-output (MOGPR) Gaussian process regression for efficient multi-objective modeling and optimization of antennas with variable-fidelity data.,"On three antenna examples (a single-band, a wideband, and a multi-band antenna in the Q, V, and S/C bands), the method significantly reduced total optimization time while maintaining high prediction accuracy, using only a small proportion of high-fidelity (HF) data; specific numerical accuracy/speedup values are not given in the available text excerpt.","In the conclusion, the authors explicitly state that the limitations of the proposed MS-CoML method were discussed, but their specific wording is not present in the available text excerpt; not stated explicitly: this likely relates to the dependence of accuracy on sufficient correlation between the variable-fidelity data and the individual design tasks.",old/139 - Multistage Collaborative Machine Learning and its Application to Antenna Modeling and Optimization.pdf
106,Koziel et al.,2021,Rapid Multi-Criterial Antenna Optimization by Means of Pareto Front Triangulation and Interpolative Design Predictors,F1,Antennas and antenna arrays,2,Classical machine learning,Pareto front triangulation + local interpolative (kriging-like) surrogate models,False,The authors propose a deterministic ML procedure for multi-objective (Pareto) antenna optimization that sequentially generates Pareto-optimal designs using triangulation of the Pareto front obtained so far and local surrogate models.,The method enables the generation of uniformly distributed Pareto fronts at a cost on the order of hundreds of antenna EM simulations; verified on three validation case studies and compared with current multi-objective optimization techniques.,"Not stated explicitly: the available excerpt has no separate section on limitations; the method is sensitive to high dimensionality and strong nonlinearity of antenna characteristics, as mentioned in the introduction as a general problem of the field.",old/129 - Rapid Multi-Criterial Antenna Optimization by Means of Pareto Front Triangulation and Interpolative Design Predictors.pdf
147,Montaser et al.,2021,Deep Learning Based Antenna Design and Beam-Steering Capabilities for Millimeter-Wave Applications,F1,Antennas and antenna arrays,1,Neural networks and deep learning,DNN (5-layer network) + hybrid MGSA-PSO optimization of hyperparameters and beam-steering,False,The authors implement a deep neural network (DNN) to compute the resonant frequency of a dual-band circularly polarized patch antenna (BSPA) and for beam-steering of a circular antenna array using a hybrid MGSA-PSO algorithm.,"A database of 150 BSPA samples was split into training (135) and test (15) sets; the 16-element beam-steering array achieved a sidelobe level ≤ -30 dB at the tested angles (40°, 142°, 205°, 320°) with good agreement between the desired and synthesized radiation patterns.","Not stated explicitly: the work does not discuss the computational requirements of training the hybrid MGSA-PSO algorithm, nor the sensitivity of the results to the size of the training database (only 150 samples).",old/166 - Deep Learning Based Antenna Design and Beam-Steering Capabilities for Millimeter-Wave Applications.pdf
136,Nakmouche et al.,2021,Development of a High Gain FSS Reflector Backed Monopole Antenna Using Machine Learning for 5G Applications,F1,Antennas and antenna arrays,1,Neural networks and deep learning,"Artificial neural network (ANN) with backpropagation, 100 neurons in the hidden layer",False,"The authors develop a high-gain monopole antenna backed by a frequency-selective surface (FSS) reflector for 5G applications, and use an artificial neural network (ANN) to find the optimal position of the FSS layer and the ground-plane dimension.","The proposed antenna (50 × 50 mm on Rogers 5880 substrate) operates in the 5.53–6.36 GHz band (targeting 6 GHz) for 5G Sub-6GHz applications; integration of the FSS layer provides a low-profile antenna with higher gain and radiation efficiency than comparable designs from the literature; the ANN model used 75% of the data for training, 10% for validation, and 15% for testing, with 100 neurons in the hidden layer.","Not stated explicitly: the available excerpt does not contain a conclusion; a likely limitation is that no fixed analytical formulas exist for this composite structure, and the validity of the ML prediction is limited to the range of the training data.",old/156 - Development of a High Gain FSS Reflector Backed Monopole Antenna Using Machine Learning for 5G Applications.pdf
128,Vu et al.,2021,Machine Learning-Enabled Joint Antenna Selection and Precoding Design: From Offline Complexity to Online Performance,F1,Antennas and antenna arrays,1,Neural networks and deep learning,Deep neural network (DNN) for antenna selection prediction and precoder design,False,"The authors propose the L-ASPD algorithm, which uses a deep neural network to learn the relationship between system parameters and selected antennas as a computationally lightweight alternative to the combinatorially complex JASPD algorithm for joint antenna selection and precoder design in multi-user MIMO downlink systems.","L-ASPD significantly outperforms baseline methods (block diagonalization, learning-assisted broadcasting solutions) in effective sum data rate under limited computation time, and reduces computational complexity by 95% while retaining more than 95% of the optimal performance.","Not stated explicitly: the available excerpt does not contain a conclusion (only author biographies); a likely limitation is the dependence of DNN performance on the quality and scope of training data, and sensitivity to changes in user/channel distribution outside the training range.",old/149 - Machine Learning-Enabled Joint Antenna Selection and Precoding Design From Offline Complexity to Online Performance.pdf
141,Wu et al.,2021,Multilayer Machine Learning-Assisted Optimization-Based Robust Design and Its Applications to Antennas and Array,F1,Antennas and antenna arrays,5,Metaheuristics and Bayesian optimization,GPR/ANN surrogate models + genetic algorithm (worst-case analysis) within a multi-layer MLAO framework,False,"The authors propose a multi-layer ML-assisted optimization method (ML-MLAO) for robust antenna and array design, which integrates surrogate models into worst-case analysis, MITH search, and robust optimization.","The method was validated on a series-fed array of 10 microstrip elements at 5.8 GHz; accurate prediction of the Pareto front and MITH was achieved while satisfying |S11|<-14 dB and SLL<-18 dB after four iterations, with significantly lower computational cost than conventional robust-design optimization methods.","Not stated explicitly in the available text (a concluding section is missing); the method requires a two-level nested iteration loop, and the accuracy of MITH prediction depends on the quality of the surrogate model in the early iterations.",old/160 - Multilayer Machine Learning-Assisted Optimization-Based Robust Design and Its Applications to Antennas and Array.pdf
75,Zardi et al.,2021,Artificial Intelligence for Adaptive and Reconfigurable Antenna Arrays: A Review,F1,Antennas and antenna arrays,1,Neural networks and deep learning,"Review of ANN/DNN/CNN, SVM, and GA across adaptive array applications",True,"AI algorithms (ANN/DNN, SVM, GA, etc.) are more robust than classical signal-processing algorithms in noisy and multipath environments and enable more efficient adaptive and reconfigurable control of antenna arrays across five key application areas.","A review article with no original quantitative results; it summarizes the use of ANN/DNN/CNN, SVM, and GA in adaptive nulling, wireless localization, MIMO communication, element failure detection, and array calibration, citing dozens of experimental papers (e.g., DNN dominates CSI estimation for MIMO, GA for calibration and failure detection).",Not stated explicitly as a methodological limitation: the authors merely note that AI algorithms are constrained by the rules and skills of their code developers and that human oversight of their decision-making is necessary.,old/100 - Artificial Intelligence for Adaptive and Reconfigurable Antenna Arrays A Review.pdf
88,Abdelhamid et al.,2022,Optimized Two-Level Ensemble Model for Predicting the Parameters of Metamaterial Antenna,F1,Antennas and antenna arrays,2,Classical machine learning,"Two-level ensemble (RF, SVR, LightGBM + ElasticNet) tuned by ASSOA",False,"A two-level ensemble regression model (RF, SVR, LightGBM at the first level + ElasticNet at the second level) tuned by the ASSOA metaheuristic can predict the bandwidth of a metamaterial antenna more accurately than previously published ensemble models.","The proposed model achieved an RMSE of 0.013, MAE of 0.004, and MBE of 0.0017 when predicting the bandwidth of a metamaterial antenna on a public benchmark dataset, outperforming the competing ensemble models compared.","Not stated explicitly: the authors merely state the superiority of their results over other models, without discussing specific limitations of the approach.",old/112 - Optimized Two-Level Ensemble Model for Predicting the Parameters of Metamaterial Antenna.pdf
121,Chen et al.,2022,Multibranch Machine Learning-Assisted Optimization and Its Application to Antenna Design,F1,Antennas and antenna arrays,2,Classical machine learning,Multi-fidelity Gaussian process regression (GPR) with an adaptive lower confidence bound (LCB) strategy and multi-branch search,False,The authors propose a multi-branch machine-learning-assisted optimization method (MB-MLAO) with an adaptive variable lower confidence bound (LCB) and retraining of a multi-fidelity GPR model for efficient antenna optimization and worst-case performance (WCP) search under manufacturing tolerances.,"The method was demonstrated on two test functions and three antenna types, where the combination of multi-fidelity GPR and multi-branch adaptive LCB search ensures a balance between exploitation and exploration; specific numerical accuracy/speedup values are not given in the available text excerpt.",Not stated explicitly: the available excerpt does not contain a concluding discussion of limitations; a likely limitation is the dependence of method performance on the choice of LCB constants and on the quality of low-fidelity (LF) data.,old/142 - Multibranch Machine Learning-Assisted Optimization and Its Application to Antenna Design.pdf
